multicultural;adj;/ˌmʌltiˈkʌltʃərəl/;London is a very  multicultural  city, with people of many different races and religions.;multicultural
neighbourhood;n;/ˈneɪbəhʊd/;I don't know my city well, yet. I just know my little  neighbourhood .;barrio
overcrowded;adj;/ˌəʊvəˈkraʊdɪd/;The city is completely  overcrowded . It's difficult to find anywhere to live.;superpoblado
pollution;n;/pəˈluːʃn/;Pollution  is a terrible problem in this city.;contaminación
postgraduate;adj;/ˌpəʊstˈɡrædʒuət/;I'm doing a  postgraduate  degree in aeronautical engineering.;posgrado
more or less;;/mɔː ɔː les/;Are we finished? ~  More or less . It'll only take ten minutes to finish.;más o menos
now and again;;/naʊ ən əˈɡeɪn/;I drink coffee  now and again , but not regularly.;de vez en cuando
now or never;;/naʊ ɔː ˈnevə/;I wasn't sure if I could learn to skydive, but I told myself it was  now or never !;ahora o nunca
once or twice;;/wʌns ɔː twaɪs/;Have you been there? ~  Once or twice –  it's a nice city.;una o dos veces
peace and quiet;;/piːs ən ˈkwaɪət/;I'd love a bit of  peace and quiet . It's so noisy here.;paz y tranquilidad
pros and cons;;/prəʊz ən kɒnz/;What are the  pros and cons  of moving to this city?;pros y contras
rain or shine;;/reɪn ɔː ʃaɪn/;We're going to visit this castle come  rain or shine . I've decided.;llueva o truene
right or wrong;;/raɪt ɔː rɒŋ/;Right or wrong , I've made my decision now. It's final.;para bien o para mal
safe and sound;;/seɪf ən saʊnd/;Despite flying through a storm we arrived  safe and sound .;sano y salvo
short and sweet;;/ʃɔːt ən swiːt/;Well, that report was  short and sweet . You summed it up well.;bueno y breve
sick and tired;;/sɪk ən ˈtaɪəd/;I’m  sick and tired  of hearing you complain.;harto
sooner or later;;/ˈsuːnə ɔː ˈleɪtə/;I'll be there  sooner or later . I'm not sure exactly when.;tarde o temprano
supply and demand;;/səˈplaɪ ən dɪˈmɑːnd/;The shops stock popular items because of  supply and demand .;oferta y demanda
thunder and lightning;;/ˈθʌndə ən ˈlaɪtnɪŋ/;The  thunder and lightning  are really dramatic. It's a huge storm!;rayos y truenos
touch and go;;/tʌtʃ ən ɡəʊ/;Will we finish it on time? ~ I don't know…it's  touch and go !;nunca se sabe
wait and see;;/weɪt ən siː/;You’ll have to  wait and see  what’s for lunch.;espera y verás
